{
  "app": "0.1.0",
  "entries": [
    {
      "addedAt": "2026-10-29T00:00:00Z",
      "codec": "apco",
      "defaults": { "defaultChannel": 1, "gain": null, "grade": null, "loop": true, "syncOffsetMs": null, "trimInMs": 500, "trimOutMs": 11500 },
      "durationMs": 12000,
      "folder": "backgrounds",
      "fps": { "den": 1, "num": 30 },
      "hasAlpha": false,
      "hasAudio": false,
      "height": 360,
      "id": "sha256:f1e1d0a1f1e1d0a1f1e1d0a1f1e1d0a1f1e1d0a1f1e1d0a1f1e1d0a1f1e1d0a1",
      "kind": "video",
      "modified": "2026-10-29T00:00:00Z",
      "path": "backgrounds/field-prores.mov",
      "poster": null,
      "size": 9000000,
      "width": 640
    },
    {
      "addedAt": "2026-10-29T00:00:00Z",
      "codec": "hvc1",
      "defaults": { "defaultChannel": 1, "gain": null, "grade": null, "loop": false, "syncOffsetMs": null, "trimInMs": 1000, "trimOutMs": 11000 },
      "durationMs": 12000,
      "folder": "backgrounds",
      "fps": { "den": 1, "num": 30 },
      "hasAlpha": false,
      "hasAudio": true,
      "height": 360,
      "id": "sha256:5c7e0a025c7e0a025c7e0a025c7e0a025c7e0a025c7e0a025c7e0a025c7e0a02",
      "kind": "video",
      "modified": "2026-10-29T00:00:00Z",
      "path": "backgrounds/sky-hevc.mov",
      "poster": null,
      "size": 3000000,
      "width": 640
    },
    {
      "addedAt": "2026-10-29T00:00:00Z",
      "codec": "hvc1",
      "defaults": { "defaultChannel": 1, "gain": -6, "grade": null, "loop": true, "syncOffsetMs": null, "trimInMs": null, "trimOutMs": null },
      "durationMs": 12000,
      "folder": "backgrounds",
      "fps": { "den": 1, "num": 30 },
      "hasAlpha": false,
      "hasAudio": true,
      "height": 360,
      "id": "sha256:a11e00a3a11e00a3a11e00a3a11e00a3a11e00a3a11e00a3a11e00a3a11e00a3",
      "kind": "video",
      "modified": "2026-10-29T00:00:00Z",
      "path": "backgrounds/river-hevc10.mov",
      "poster": null,
      "size": 4500000,
      "width": 640
    },
    {
      "addedAt": "2026-10-29T00:00:00Z",
      "codec": "ap4h",
      "defaults": { "defaultChannel": 1, "gain": null, "grade": null, "loop": false, "syncOffsetMs": null, "trimInMs": null, "trimOutMs": null },
      "durationMs": 6000,
      "folder": "backgrounds",
      "fps": { "den": 1, "num": 30 },
      "hasAlpha": true,
      "hasAudio": false,
      "height": 360,
      "id": "sha256:11a4e0a411a4e0a411a4e0a411a4e0a411a4e0a411a4e0a411a4e0a411a4e0a4",
      "kind": "video",
      "modified": "2026-10-29T00:00:00Z",
      "path": "backgrounds/light-prores4444.mov",
      "poster": null,
      "size": 30000000,
      "width": 640
    },
    {
      "addedAt": "2026-10-29T00:00:00Z",
      "codec": "avc1",
      "defaults": { "defaultChannel": 1, "gain": null, "grade": null, "loop": false, "syncOffsetMs": null, "trimInMs": null, "trimOutMs": null },
      "durationMs": 3000,
      "folder": "clapper",
      "fps": { "den": 1, "num": 30 },
      "hasAlpha": false,
      "hasAudio": true,
      "height": 360,
      "id": "sha256:c1a99e71c1a99e71c1a99e71c1a99e71c1a99e71c1a99e71c1a99e71c1a99e71",
      "kind": "video",
      "modified": "2026-10-29T00:00:00Z",
      "path": "clapper/clapper.mov",
      "poster": null,
      "size": 800000,
      "width": 640
    },
    {
      "addedAt": "2026-10-29T00:00:00Z",
      "codec": "png",
      "defaults": { "defaultChannel": 1, "gain": null, "grade": null, "loop": false, "syncOffsetMs": null, "trimInMs": null, "trimOutMs": null },
      "durationMs": null,
      "folder": "stills",
      "fps": null,
      "hasAlpha": false,
      "hasAudio": false,
      "height": 360,
      "id": "sha256:c0550a06c0550a06c0550a06c0550a06c0550a06c0550a06c0550a06c0550a06",
      "kind": "image",
      "modified": "2026-10-29T00:00:00Z",
      "path": "stills/cross.png",
      "poster": null,
      "size": 20000,
      "width": 640
    }
  ],
  "kind": "mediaIndex",
  "replaced": {},
  "schema": 1
}
