{
  "app": "0.1.0",
  "entries": [
    {
      "addedAt": "2026-10-18T13:02:11Z",
      "codec": "avc1",
      "defaults": { "defaultChannel": 1, "gain": null, "grade": null, "loop": true, "syncOffsetMs": null, "trimInMs": null, "trimOutMs": null },
      "durationMs": 2000,
      "folder": "backgrounds",
      "fps": { "den": 1, "num": 4 },
      "hasAlpha": false,
      "hasAudio": false,
      "height": 36,
      "id": "sha256:55c84469c37e1e6a72a9b8938422cd6536b302b583a5c127241c8304246f3527",
      "kind": "video",
      "modified": "2026-10-18T13:02:09Z",
      "path": "backgrounds/dawn.mp4",
      "poster": "posters/dawn-55c84469.png",
      "size": 1292,
      "width": 64
    },
    {
      "addedAt": "2026-10-19T09:40:00Z",
      "codec": "hvc1",
      "defaults": { "defaultChannel": 1, "gain": -3, "grade": 1, "loop": true, "syncOffsetMs": 40, "trimInMs": 1500, "trimOutMs": 58000 },
      "durationMs": 60000,
      "folder": "backgrounds",
      "fps": { "den": 1001, "num": 30000 },
      "hasAlpha": false,
      "hasAudio": true,
      "height": 1080,
      "id": "sha256:9f2c6a1b9f2c6a1b9f2c6a1b9f2c6a1b9f2c6a1b9f2c6a1b9f2c6a1b9f2c6a1b",
      "kind": "video",
      "modified": "2026-10-19T09:39:58Z",
      "path": "backgrounds/mountains.mp4",
      "poster": "posters/mountains-9f2c6a1b.png",
      "size": 48213774,
      "width": 1920
    },
    {
      "addedAt": "2026-10-18T13:05:40Z",
      "codec": "png",
      "defaults": { "defaultChannel": null, "gain": null, "grade": null, "loop": false, "syncOffsetMs": null, "trimInMs": null, "trimOutMs": null },
      "durationMs": null,
      "folder": "backgrounds",
      "fps": null,
      "hasAlpha": false,
      "hasAudio": false,
      "height": 36,
      "id": "sha256:eb6384847a49f7a4ef82aedb9e2019080777b8be748690c33d91bba67c32a3d2",
      "kind": "image",
      "modified": "2026-10-18T13:05:38Z",
      "path": "backgrounds/cross.png",
      "poster": null,
      "size": 134,
      "width": 64
    },
    {
      "addedAt": "2026-10-20T15:04:05Z",
      "codec": null,
      "defaults": { "defaultChannel": 2, "gain": null, "grade": null, "loop": false, "syncOffsetMs": null, "trimInMs": null, "trimOutMs": null },
      "durationMs": null,
      "folder": "slides",
      "fps": null,
      "hasAlpha": true,
      "hasAudio": false,
      "height": 1080,
      "id": "slide:51de0000-0000-4000-8000-000000000001",
      "kind": "slide",
      "modified": "2026-10-20T15:04:05Z",
      "path": "slides/welcome.oslide",
      "poster": null,
      "size": 412,
      "width": 1920
    }
  ],
  "kind": "mediaIndex",
  "replaced": {},
  "schema": 1
}
